[
    {
        "question": "Give me all soccer clubs in the Premier League?\n",
        "final_answer": "Arsenal, Aston Villa, Brentford, Brighton & Hove Albion, Burnley, Chelsea, Crystal Palace, Everton, Leeds United, Leicester City, Liverpool, Manchester City, Manchester United, Newcastle United, Norwich City, Southampton, Tottenham Hotspur, Watford, West Ham United, Wolverhampton Wanderers.",
        "wikipedia_answer": "None",
        "wikidata_answer": "['Luton Town F.C.', 'Cardiff City F.C.', 'Middlesbrough F.C.', 'Tottenham Hotspur F.C.', 'Nottingham Forest F.C.', 'Leicester City F.C.', 'AFC Bournemouth', 'Liverpool F.C.', 'Chelsea F.C.', 'Huddersfield Town A.F.C.', 'Fulham F.C.', 'Newcastle United F.C.', 'Aston Villa F.C.', 'Southampton F.C.', 'Stoke City F.C.', 'Brentford F.C.', 'Manchester City F.C.', 'Club Atl\u00e9tico Chaco For Ever', 'West Bromwich Albion F.C.', 'Burnley F.C.', 'Crystal Palace F.C.', 'Watford F.C.', 'Everton F.C.', 'Arsenal F.C.', 'Manchester United F.C.', 'West Ham United F.C.', 'Brighton & Hove Albion F.C.', 'Wolverhampton Wanderers F.C.']",
        "internal_knowledge": "Arsenal, Aston Villa, Brentford, Brighton & Hove Albion, Burnley, Chelsea, Crystal Palace, Everton, Leeds United, Leicester City, Liverpool, Manchester City, Manchester United, Newcastle United, Norwich City, Southampton, Tottenham Hotspur, Watford, West Ham United, Wolverhampton Wanderers.",
        "error": null,
        "intermediate_logs": "Give me all soccer clubs in the Premier League?\n\nThought: To find all soccer clubs in the Premier League, I need to first find more information about the Premier League on Wikipedia.\n\nAction: WikiSearch\n\nAction Input: Premier League\n\nObservation:Page: Premier League\nSummary: The Premier League is the highest level of the English football league system, contested by 20 clubs. It operates on a system of promotion and relegation with the English Football League (EFL). Since its inception in 1992, 51 clubs have competed, including 49 English and two Welsh clubs.\n\nThought: The Wikipedia summary states that the Premier League is contested by 20 clubs. However, it does not provide the names of the clubs. I will now try to find the clubs using Wikidata.\n\nAction: GetWikidataID\n\nAction Input: Premier League\n\nObservation:['Q9448']\n\nThought: With the QID of Premier League, I can now construct a SPARQL query to find all soccer clubs in the Premier League.\n\nAction: GenerateSparql\n\nAction Input: Q9448\n\nObservation:SELECT DISTINCT ?x1 WHERE { ?x1 wdt:P31 wd:Q476028 . ?x1 p:P118 ?x2 . ?x2 ps:P118 wd:Q9448 . }\n\nThought: The SPARQL query has been generated, and I will now execute it to find all soccer clubs in the Premier League.\n\nAction: RunSparql\n\nAction Input: SELECT DISTINCT ?x1 WHERE { ?x1 wdt:P31 wd:Q476028 . ?x1 p:P118 ?x2 . ?x2 ps:P118 wd:Q9448 . }\n\nObservation:{'message': [{'value': 'http://www.wikidata.org/entity/Q18520'}, {'value': 'http://www.wikidata.org/entity/Q18662'}, {'value': 'http://www.wikidata.org/entity/Q18661'}, {'value': 'http://www.wikidata.org/entity/Q18741'}, {'value': 'http://www.wikidata.org/entity/Q19490'}, {'value': 'http://www.wikidata.org/entity/Q19481'}, {'value': 'http://www.wikidata.org/entity/Q19568'}, {'value': 'http://www.wikidata.org/entity/Q1130849'}, {'value': 'http://www.wikidata.org/entity/Q9616'}, {'value': 'http://www.wikidata.org/entity/Q19473'}, {'value': 'http://www.wikidata.org/entity/Q18708'}, {'value': 'http://www.wikidata.org/entity/Q18716'}, {'value': 'http://www.wikidata.org/entity/Q18711'}, {'value': 'http://www.wikidata.org/entity/Q18732'}, {'value': 'http://www.wikidata.org/entity/Q18736'}, {'value': 'http://www.wikidata.org/entity/Q19571'}, {'value': 'http://www.wikidata.org/entity/Q50602'}, {'value': 'http://www.wikidata.org/entity/Q3781627'}, {'value': 'http://www.wikidata.org/entity/Q18744'}, {'value': 'http://www.wikidata.org/entity/Q19458'}, {'value': 'http://www.wikidata.org/entity/Q19467'}, {'value': 'http://www.wikidata.org/entity/Q2714'}, {'value': 'http://www.wikidata.org/entity/Q5794'}, {'value': 'http://www.wikidata.org/entity/Q9617'}, {'value': 'http://www.wikidata.org/entity/Q18656'}, {'value': 'http://www.wikidata.org/entity/Q18747'}, {'value': 'http://www.wikidata.org/entity/Q19453'}, {'value': 'http://www.wikidata.org/entity/Q19500'}]}\n\nThought: I have received a list of QIDs for the soccer clubs in the Premier League. I will now convert these QIDs into labels to provide the names of the clubs.\n\nAction: GetLabel\n\nAction Input: ['Q18520', 'Q18662', 'Q18661', 'Q18741', 'Q19490', 'Q19481', 'Q19568', 'Q1130849', 'Q9616', 'Q19473', 'Q18708', 'Q18716', 'Q18711', 'Q18732', 'Q18736', 'Q19571', 'Q50602', 'Q3781627', 'Q18744', 'Q19458', 'Q19467', 'Q2714', 'Q5794', 'Q9617', 'Q18656', 'Q18747', 'Q19453', 'Q19500']\n\nObservation:['Luton Town F.C.', 'Cardiff City F.C.', 'Middlesbrough F.C.', 'Tottenham Hotspur F.C.', 'Nottingham Forest F.C.', 'Leicester City F.C.', 'AFC Bournemouth', 'Liverpool F.C.', 'Chelsea F.C.', 'Huddersfield Town A.F.C.', 'Fulham F.C.', 'Newcastle United F.C.', 'Aston Villa F.C.', 'Southampton F.C.', 'Stoke City F.C.', 'Brentford F.C.', 'Manchester City F.C.', 'Club Atl\u00e9tico Chaco For Ever', 'West Bromwich Albion F.C.', 'Burnley F.C.', 'Crystal Palace F.C.', 'Watford F.C.', 'Everton F.C.', 'Arsenal F.C.', 'Manchester United F.C.', 'West Ham United F.C.', 'Brighton & Hove Albion F.C.', 'Wolverhampton Wanderers F.C.']\n\nThought: I now know the final answer based on both Wikipedia and Wikidata. \nFinal Answer: Wikipedia_Answer: None, Wikidata_Answer: ['Luton Town F.C.', 'Cardiff City F.C.', 'Middlesbrough F.C.', 'Tottenham Hotspur F.C.', 'Nottingham Forest F.C.', 'Leicester City F.C.', 'AFC Bournemouth', 'Liverpool F.C.', 'Chelsea F.C.', 'Huddersfield Town A.F.C.', 'Fulham F.C.', 'Newcastle United F.C.', 'Aston Villa F.C.', 'Southampton F.C.', 'Stoke City F.C.', 'Brentford F.C.', 'Manchester City F.C.', 'Club Atl\u00e9tico Chaco For Ever', 'West Bromwich Albion F.C.', 'Burnley F.C.', 'Crystal Palace F.C.', 'Watford F.C.', 'Everton F.C.', 'Arsenal F.C.', 'Manchester United F.C.', 'West Ham United F.C.', 'Brighton & Hove Albion F.C.', 'Wolverhampton Wanderers F.C.']\n\nAssistant Response: The soccer clubs in the Premier League, according to Wikidata, are Luton Town F.C., Cardiff City F.C., Middlesbrough F.C., Tottenham Hotspur F.C., Nottingham Forest F.C., Leicester City F.C., AFC Bournemouth, Liverpool F.C., Chelsea F.C., Huddersfield Town A.F.C., Fulham F.C., Newcastle United F.C., Aston Villa F.C., Southampton F.C., Stoke City F.C., Brentford F.C., Manchester City F.C., Club Atl\u00e9tico Chaco For Ever, West Bromwich Albion F.C., Burnley F.C., Crystal Palace F.C., Watford F.C., Everton F.C., Arsenal F.C., Manchester United F.C., West Ham United F.C., Brighton & Hove Albion F.C., and Wolverhampton Wanderers F.C. Please note that this list may change as clubs are promoted or relegated., Internal Knowledge: Arsenal, Aston Villa, Brentford, Brighton & Hove Albion, Burnley, Chelsea, Crystal Palace, Everton, Leeds United, Leicester City, Liverpool, Manchester City, Manchester United, Newcastle United, Norwich City, Southampton, Tottenham Hotspur, Watford, West Ham United, Wolverhampton Wanderers."
    },
    {
        "question": "Where did Hillel Slovak die?",
        "final_answer": "Haifa",
        "wikipedia_answer": "None",
        "wikidata_answer": "[Haifa]",
        "internal_knowledge": "Hillel Slovak died in Los Angeles, California.",
        "error": null,
        "intermediate_logs": "Where did Hillel Slovak die?\n\nThought: First, I need to find information about Hillel Slovak.\n\nAction: WikiSearch\n\nAction Input: Hillel Slovak\n\nObservation:Page: Hillel Slovak\nSummary: Hillel Slovak was an Israeli-American musician and founding guitarist of the Los Angeles rock band Red Hot Chili Peppers. Born in Israel, he later moved to the United States and met future bandmates Anthony Kiedis, Flea, and Jack Irons while attending Fairfax High School in Los Angeles. Slovak recorded two albums with the Chili Peppers, Freaky Styley (1985) and The Uplift Mofo Party Plan (1987). He developed a serious heroin addiction and died of an overdose on June 25, 1988, at age 26.\n\nThought: According to the Wikipedia summary, Hillel Slovak died of a heroin overdose. However, the location of his death is not mentioned. I will try to find this information using Wikidata.\n\nAction: GetWikidataID\n\nAction Input: Hillel Slovak\n\nObservation:['Q186924']\n\nThought: Now that I have the Wikidata ID for Hillel Slovak, I can construct a SPARQL query to find the location of his death.\n\nAction: GenerateSparql\n\nAction Input: Q186924\n\nObservation:SELECT DISTINCT ?x1 WHERE { wd:Q186924 p:P19 ?x2 . ?x2 ps:P19 ?x1 . }\n\nThought: I will now execute the SPARQL query to find the location of Hillel Slovak's death.\n\nAction: RunSparql\n\nAction Input: SELECT DISTINCT ?x1 WHERE { wd:Q186924 p:P19 ?x2 . ?x2 ps:P19 ?x1 . }\n\nObservation:{'message': [{'value': 'http://www.wikidata.org/entity/Q41621'}]}\n\nThought: I have received a QID for the location of Hillel Slovak's death. I will now convert this QID into a label.\n\nAction: GetLabel\n\nAction Input: [Q41621]\n\nObservation:['Haifa']\n\nThought: I now know the final answer based on both Wikipedia and Wikidata. \nFinal Answer: Wikipedia_Answer: None, Wikidata_Answer: [Haifa]\n\nAssistant Response: The Wikipedia summary for Hillel Slovak does not provide the location of his death. However, according to Wikidata, Hillel Slovak died in Haifa., Internal Knowledge: Hillel Slovak died in Los Angeles, California."
    }
]